<?xml version="1.0" encoding="UTF-8"?>

<!DOCTYPE Base SYSTEM 'asm3_DTDs_giaohang.dtd'[
    <!ENTITY moto "by moto">
    <!ENTITY truck "by truck">
]>

<delivered-products>
    <delivered-product>
        <invoice  by="&truck;" date="2018/03/11" id="IV123" ></invoice>
        <customer>
            <name>Tuan Anh</name>
            <address>123 Le Thanh Ton Q1</address>
        </customer>
        <product id="P00001">
            <product-name>TV Sony Wega 46 inches</product-name>
            <quality>2</quality>
            <price>$450</price>
        </product>
    </delivered-product>

</delivered-products>